{
  "schema_version": "1.0",
  "confidence": "🤖",
  "metadata": {
    "created_at": "2026-05-30",
    "extract_provenance": {
      "model": "opus-4.7-1M",
      "extract_route": "Vision-extract PNG Cijferzakboekje 2026",
      "extract_prompt": "prompts/tarief-extractie-v1.md"
    }
  },
  "id": "vaa-overige-leningen",
  "titel": "Voordeel van alle aard: overige leningen en financieringen — referentierentevoeten",
  "categorie": "personenbelasting",
  "wetsbasis": [
    {
      "bron": "KB/WIB92",
      "artikel": "18, §3, 1"
    }
  ],
  "geldigheidsperiode": {
    "vanaf_boekjaar": 1985,
    "tot_boekjaar": null,
    "wijziging_door": "Jaarlijkse aanpassing referentierentevoeten"
  },
  "samenvatting": "Belastbaar voordeel van alle aard voor renteloze of goedkope leningen door werkgever/vennootschap. Twee categorieën: hypothecaire leningen met vaste rentevoet (gewaarborgd door levensverzekering vs andere) en niet-hypothecaire leningen met vaste looptijd (autolening vs andere). Niet-hypothecaire vaste looptijd: maandelijks tarief — gebaseerd op tabel of formule i = (1+p)^12 - 1 (sinds 01.01.2023) of i = (p × 24 × n)/(n+1) (t/m 31.12.2022).",
  "criteria": [
    {
      "naam": "Hypothecaire — Gewaarborgd door levensverzekering — 2025",
      "tarief_pct": 3.0,
      "eenheid": "%/jaar",
      "toelichting": "Toepasselijke referentierentevoet voor leningen afgesloten sinds 01.01.2023 (geldt voor ondertekening) — 'andere lening' is identiek."
    },
    {
      "naam": "Hypothecaire — 2024",
      "tarief_pct": 3.28,
      "eenheid": "%/jaar"
    },
    {
      "naam": "Hypothecaire — 2023",
      "tarief_pct": 3.14,
      "eenheid": "%/jaar"
    },
    {
      "naam": "Hypothecaire — 2022",
      "tarief_pct": 1.77,
      "eenheid": "%/jaar"
    },
    {
      "naam": "Hypothecaire — Gewaarborgd door levensverzekering — 2021",
      "tarief_pct": 1.34,
      "eenheid": "%/jaar"
    },
    {
      "naam": "Hypothecaire — Andere lening — 2021",
      "tarief_pct": 1.29,
      "eenheid": "%/jaar"
    },
    {
      "naam": "Hypothecaire — Gewaarborgd door levensverzekering — 2020",
      "tarief_pct": 1.41,
      "eenheid": "%/jaar"
    },
    {
      "naam": "Hypothecaire — Andere lening — 2020",
      "tarief_pct": 1.36,
      "eenheid": "%/jaar"
    },
    {
      "naam": "Hypothecaire — Gewaarborgd door levensverzekering — 2019",
      "tarief_pct": 1.7,
      "eenheid": "%/jaar"
    },
    {
      "naam": "Hypothecaire — Andere lening — 2019",
      "tarief_pct": 1.58,
      "eenheid": "%/jaar"
    },
    {
      "naam": "Hypothecaire — Gewaarborgd door levensverzekering — 2018",
      "tarief_pct": 1.8,
      "eenheid": "%/jaar"
    },
    {
      "naam": "Hypothecaire — Andere lening — 2018",
      "tarief_pct": 1.7,
      "eenheid": "%/jaar"
    },
    {
      "naam": "Niet-hypothecaire — Autolening — 2025",
      "tarief_pct": 0.26,
      "eenheid": "%/maand"
    },
    {
      "naam": "Niet-hypothecaire — Andere lening — 2025",
      "tarief_pct": 0.52,
      "eenheid": "%/maand"
    },
    {
      "naam": "Niet-hypothecaire — Autolening — 2024",
      "tarief_pct": 0.28,
      "eenheid": "%/maand"
    },
    {
      "naam": "Niet-hypothecaire — Andere lening — 2024",
      "tarief_pct": 0.55,
      "eenheid": "%/maand"
    },
    {
      "naam": "Niet-hypothecaire — Autolening — 2023",
      "tarief_pct": 0.25,
      "eenheid": "%/maand"
    },
    {
      "naam": "Niet-hypothecaire — Andere lening — 2023",
      "tarief_pct": 0.49,
      "eenheid": "%/maand"
    },
    {
      "naam": "Niet-hypothecaire — Autolening — 2022",
      "tarief_pct": 0.06,
      "eenheid": "%/maand"
    },
    {
      "naam": "Niet-hypothecaire — Andere lening — 2022",
      "tarief_pct": 0.12,
      "eenheid": "%/maand"
    },
    {
      "naam": "Niet-hypothecaire — Autolening — 2021",
      "tarief_pct": 0.05,
      "eenheid": "%/maand"
    },
    {
      "naam": "Niet-hypothecaire — Andere lening — 2021",
      "tarief_pct": 0.11,
      "eenheid": "%/maand"
    },
    {
      "naam": "Niet-hypothecaire — Autolening — 2020",
      "tarief_pct": 0.04,
      "eenheid": "%/maand"
    },
    {
      "naam": "Niet-hypothecaire — Andere lening — 2020",
      "tarief_pct": 0.12,
      "eenheid": "%/maand"
    },
    {
      "naam": "Formule reëel jaarlijks lastenpercentage — sinds 01.01.2023",
      "waarde": "i = (1+p)^12 − 1",
      "eenheid": "formule",
      "toelichting": "Voor leningsovereenkomsten afgesloten sinds 01.01.2023 (KB 12.01.2024, BS 25.01.2024). p = maandelijks lastenpercentage."
    },
    {
      "naam": "Formule reëel jaarlijks lastenpercentage — t/m 31.12.2022",
      "waarde": "i = (p × 24 × n)/(n+1)",
      "eenheid": "formule",
      "toelichting": "Voor leningsovereenkomsten afgesloten t/m 31.12.2022. p = maandelijks lastenpercentage, n = aantal terugbetalingstermijnen in maanden."
    }
  ],
  "bron": {
    "primair": "Cijferzakboekje 2026 p116-p117 — Voordelen van alle aard: overige leningen en financieringen",
    "wettekst": "Art. 18, §3, 1 KB/WIB92 — KB van 12.01.2024 (BS 25.01.2024)",
    "cijferzakboekje_pagina": 116,
    "verified_via": "Vision-extract PNG data/tarieven/pages/p125.png + p126.png"
  },
  "tags": [
    "personenbelasting",
    "vaa",
    "leningen",
    "rentevoet",
    "kb-wib92"
  ]
}
